{
  "schema_version": "1",
  "rules_version": 1,
  "updated": "2026-10-29",
  "default_category": "Other",
  "apps": [
    {"process": "code", "category": "Work"},
    {"process": "devenv", "category": "Work"},
    {"process": "pycharm64", "category": "Work"},
    {"process": "pycharm", "category": "Work"},
    {"process": "idea64", "category": "Work"},
    {"process": "idea", "category": "Work"},
    {"process": "webstorm64", "category": "Work"},
    {"process": "clion64", "category": "Work"},
    {"process": "rider64", "category": "Work"},
    {"process": "datagrip64", "category": "Work"},
    {"process": "goland64", "category": "Work"},
    {"process": "phpstorm64", "category": "Work"},
    {"process": "studio64", "category": "Work"},
    {"process": "eclipse", "category": "Work"},
    {"process": "notepad++", "category": "Work"},
    {"process": "sublime_text", "category": "Work"},
    {"process": "windowsterminal", "category": "Work"},
    {"process": "powershell", "category": "Work"},
    {"process": "pwsh", "category": "Work"},
    {"process": "cmd", "category": "Work"},
    {"process": "mintty", "category": "Work"},
    {"process": "winword", "category": "Work"},
    {"process": "excel", "category": "Work"},
    {"process": "powerpnt", "category": "Work"},
    {"process": "outlook", "category": "Work"},
    {"process": "msaccess", "category": "Work"},
    {"process": "winproj", "category": "Work"},
    {"process": "visio", "category": "Work"},
    {"process": "onenote", "category": "Work"},
    {"process": "teams", "category": "Work"},
    {"process": "ms-teams", "category": "Work"},
    {"process": "zoom", "category": "Work"},
    {"process": "slack", "category": "Work"},
    {"process": "figma", "category": "Work"},
    {"process": "photoshop", "category": "Work"},
    {"process": "illustrator", "category": "Work"},
    {"process": "indesign", "category": "Work"},
    {"process": "afterfx", "category": "Work"},
    {"process": "postman", "category": "Work"},
    {"process": "ssms", "category": "Work"},
    {"process": "notion", "category": "Work"},
    {"process": "githubdesktop", "category": "Work"},
    {"process": "sourcetree", "category": "Work"},
    {"process": "gitkraken", "category": "Work"},
    {"process": "thunderbird", "category": "Work"},
    {"process": "evernote", "category": "Work"},
    {"process": "todoist", "category": "Work"},
    {"process": "soffice", "category": "Work"},
    {"process": "inkscape", "category": "Work"},
    {"process": "krita", "category": "Work"},
    {"process": "blender", "category": "Work"},
    {"process": "unity", "category": "Work"},
    {"process": "unrealeditor", "category": "Work"},
    {"process": "obsidian", "category": "Work"},
    {"process": "anki", "category": "Study"},
    {"process": "zotero", "category": "Study"},
    {"process": "geogebra", "category": "Study"},
    {"process": "matlab", "category": "Study"},
    {"process": "rstudio", "category": "Study"},
    {"process": "texstudio", "category": "Study"},
    {"process": "texmaker", "category": "Study"},
    {"process": "mathematica", "category": "Study"},
    {"process": "spotify", "category": "Entertainment"},
    {"process": "netflix", "category": "Entertainment"},
    {"process": "vlc", "category": "Entertainment"},
    {"process": "wmplayer", "category": "Entertainment"},
    {"process": "potplayermini64", "category": "Entertainment"},
    {"process": "potplayermini", "category": "Entertainment"},
    {"process": "mpv", "category": "Entertainment"},
    {"process": "plex", "category": "Entertainment"},
    {"process": "video.ui", "category": "Entertainment"},
    {"process": "music.ui", "category": "Entertainment"},
    {"process": "amazonmusic", "category": "Entertainment"},
    {"process": "tidal", "category": "Entertainment"},
    {"process": "steam", "category": "Entertainment"},
    {"process": "steamwebhelper", "category": "Entertainment"},
    {"process": "epicgameslauncher", "category": "Entertainment"},
    {"process": "battle.net", "category": "Entertainment"},
    {"process": "eadesktop", "category": "Entertainment"},
    {"process": "origin", "category": "Entertainment"},
    {"process": "galaxyclient", "category": "Entertainment"},
    {"process": "riotclientservices", "category": "Entertainment"},
    {"process": "leagueclient", "category": "Entertainment"},
    {"process": "valorant-win64-shipping", "category": "Entertainment"},
    {"process": "fortniteclient-win64-shipping", "category": "Entertainment"},
    {"process": "minecraftlauncher", "category": "Entertainment"},
    {"process": "minecraft.windows", "category": "Entertainment"},
    {"process": "robloxplayerbeta", "category": "Entertainment"},
    {"process": "gta5", "category": "Entertainment"},
    {"process": "cs2", "category": "Entertainment"},
    {"process": "csgo", "category": "Entertainment"},
    {"process": "dota2", "category": "Entertainment"},
    {"process": "rocketleague", "category": "Entertainment"},
    {"process": "xboxpcapp", "category": "Entertainment"},
    {"process": "whatsapp", "category": "Social Media"},
    {"process": "telegram", "category": "Social Media"},
    {"process": "signal", "category": "Social Media"},
    {"process": "messenger", "category": "Social Media"},
    {"process": "viber", "category": "Social Media"},
    {"process": "line", "category": "Social Media"},
    {"process": "wechat", "category": "Social Media"},
    {"process": "discord", "category": "Social Media"},
    {"process": "skype", "category": "Social Media"},
    {"process": "tiktok", "category": "Social Media"},
    {"process": "zalo", "category": "Social Media"},
    {"process": "chrome", "category": "Other", "note": "a browser: the real category comes from the site, which the extension reports"},
    {"process": "msedge", "category": "Other", "note": "a browser: the real category comes from the site, which the extension reports"},
    {"process": "firefox", "category": "Other", "note": "a browser: the real category comes from the site, which the extension reports"},
    {"process": "brave", "category": "Other", "note": "a browser: the real category comes from the site, which the extension reports"},
    {"process": "opera", "category": "Other", "note": "a browser: the real category comes from the site, which the extension reports"},
    {"process": "vivaldi", "category": "Other", "note": "a browser: the real category comes from the site, which the extension reports"},
    {"process": "iexplore", "category": "Other"},
    {"process": "explorer", "category": "Other"},
    {"process": "systemsettings", "category": "Other"},
    {"process": "taskmgr", "category": "Other"},
    {"process": "calculatorapp", "category": "Other"},
    {"process": "mspaint", "category": "Other"},
    {"process": "snippingtool", "category": "Other"},
    {"process": "regedit", "category": "Other"},
    {"process": "winstore.app", "category": "Other"},
    {"process": "onedrive", "category": "Other"},
    {"process": "7zfg", "category": "Other"},
    {"process": "winrar", "category": "Other"},
    {"process": "powertoys", "category": "Other"},
    {"process": "teamviewer", "category": "Other"},
    {"process": "setup", "category": "Other"}
  ],
  "sites": [
    {"match": "suffix", "value": "docs.google.com", "category": "Work"},
    {"match": "suffix", "value": "sheets.google.com", "category": "Work"},
    {"match": "suffix", "value": "slides.google.com", "category": "Work"},
    {"match": "suffix", "value": "forms.google.com", "category": "Work"},
    {"match": "suffix", "value": "calendar.google.com", "category": "Work"},
    {"match": "suffix", "value": "meet.google.com", "category": "Work"},
    {"match": "suffix", "value": "mail.google.com", "category": "Work"},
    {"match": "suffix", "value": "drive.google.com", "category": "Work"},
    {"match": "suffix", "value": "console.cloud.google.com", "category": "Work"},
    {"match": "suffix", "value": "mail.yahoo.com", "category": "Work"},
    {"match": "suffix", "value": "console.aws.amazon.com", "category": "Work"},
    {"match": "suffix", "value": "aws.amazon.com", "category": "Work"},
    {"match": "suffix", "value": "learn.microsoft.com", "category": "Work"},
    {"match": "suffix", "value": "teams.microsoft.com", "category": "Work"},
    {"match": "suffix", "value": "outlook.office.com", "category": "Work"},
    {"match": "suffix", "value": "outlook.live.com", "category": "Work"},
    {"match": "suffix", "value": "developer.mozilla.org", "category": "Work"},
    {"match": "suffix", "value": "docs.python.org", "category": "Work"},
    {"match": "suffix", "value": "classroom.google.com", "category": "Study"},
    {"match": "suffix", "value": "scholar.google.com", "category": "Study"},
    {"match": "suffix", "value": "nlm.nih.gov", "category": "Study"},
    {"match": "suffix", "value": "edu", "category": "Study", "note": "schools and universities"},
    {"match": "suffix", "value": "edu.pk", "category": "Study"},
    {"match": "suffix", "value": "ac.uk", "category": "Study"},
    {"match": "suffix", "value": "ac.in", "category": "Study"},
    {"match": "suffix", "value": "edu.in", "category": "Study"},
    {"match": "suffix", "value": "edu.au", "category": "Study"},
    {"match": "suffix", "value": "ac.jp", "category": "Study"},
    {"match": "suffix", "value": "ac.nz", "category": "Study"},
    {"match": "suffix", "value": "edu.bd", "category": "Study"},
    {"match": "suffix", "value": "edu.my", "category": "Study"},
    {"match": "suffix", "value": "ac.za", "category": "Study"},
    {"match": "suffix", "value": "gov", "category": "Other", "note": "government sites"},
    {"match": "suffix", "value": "gov.pk", "category": "Other"},
    {"match": "suffix", "value": "gov.uk", "category": "Other"},
    {"match": "suffix", "value": "gov.in", "category": "Other"},
    {"match": "suffix", "value": "gov.au", "category": "Other"},